{
  "id": "civic-tech",
  "title": "Civic Tech & Transparency",
  "tagline": "Open government, accountability, and data-for-good projects",
  "description": "Nepal has a small but high-quality civic-tech scene. YoungInnovations builds international transparency platforms (AidStream, ResourceContracts). Code for Nepal, Open Knowledge Nepal, Kathmandu Living Labs, and Accountability Lab Nepal lead the space.",
  "icon": "✯",
  "order": 19,
  "resources": [
    {
      "name": "Code for Nepal",
      "url": "https://codefornepal.org",
      "description": "501(c)(3) civic-tech nonprofit since 2014. Repos at github.com/codefornepal: NepalMap, satyasangraha, newsbot, gw-predictor, akshara-project.",
      "status": "community",
      "maintenance": "active",
      "api": "sdk",
      "starred": true
    },
    {
      "name": "NepalMap",
      "url": "https://nepalmap.org",
      "description": "Civic-data dashboard by Code for Nepal.",
      "status": "community",
      "maintenance": "active",
      "api": "none",
      "starred": true
    },
    {
      "name": "YoungInnovations",
      "url": "https://www.younginnovations.com.np",
      "description": "Civic-tech and transparency dev shop. 39 GitHub repos. Built AidStream (NGO IATI publishing), ResourceContracts (oil/gas/mining transparency), UN Transparency Portal.",
      "status": "official",
      "maintenance": "active",
      "api": "sdk",
      "starred": true
    },
    {
      "name": "AidStream",
      "url": "https://aidstream.org",
      "description": "NGO IATI publishing platform — flagship YoungInnovations product.",
      "status": "community",
      "maintenance": "active",
      "api": "rest"
    },
    {
      "name": "ResourceContracts",
      "url": "https://resourcecontracts.org",
      "description": "Oil, gas, and mining contract transparency platform.",
      "status": "community",
      "maintenance": "active",
      "api": "rest"
    },
    {
      "name": "Kathmandu Living Labs",
      "url": "https://kathmandulivinglabs.org",
      "description": "Pioneer civic-tech NGO. OSM Nepal lead. Built QuakeMap and METEOR exposure surveys.",
      "status": "community",
      "maintenance": "active",
      "api": "none",
      "starred": true
    },
    {
      "name": "AskNepal",
      "url": "https://asknepal.info",
      "description": "Right-to-Information (RTI) request platform by Open Knowledge Nepal.",
      "status": "community",
      "maintenance": "active",
      "api": "none"
    },
    {
      "name": "Local Boundaries",
      "url": "https://localboundries.oknp.org",
      "description": "Open Knowledge Nepal's local-boundary geodata.",
      "status": "community",
      "maintenance": "active",
      "api": "none"
    },
    {
      "name": "Election Nepal",
      "url": "https://github.com/openknowledgenp/election-nepal",
      "description": "Open Knowledge Nepal's elections data project.",
      "status": "community",
      "maintenance": "stale",
      "api": "none"
    },
    {
      "name": "Accountability Lab Nepal",
      "url": "https://nepal.accountabilitylab.org",
      "description": "Integrity Icon, CivActs, SpeakUp Nepal, OpenGovHub Kathmandu.",
      "status": "community",
      "maintenance": "active",
      "api": "none"
    },
    {
      "name": "Freedom Forum Nepal",
      "url": "https://freedomforum.org.np",
      "description": "Open Budget Nepal coordinator. Latest Open Budget Index 2023: 50/100.",
      "status": "community",
      "maintenance": "active",
      "api": "none"
    },
    {
      "name": "Digital Rights Nepal",
      "url": "https://digitalrightsnepal.org",
      "description": "Civic org focused on Nepal's digital-rights advocacy.",
      "status": "community",
      "maintenance": "active",
      "api": "none"
    },
    {
      "name": "NAXA",
      "url": "https://naxa.com.np",
      "description": "GIS consultancy doing civic-data work.",
      "status": "official",
      "maintenance": "active",
      "api": "none"
    }
  ]
}
