{
  "id": "blogs-podcasts",
  "title": "Blogs, Podcasts & YouTube",
  "tagline": "Tutorials, technical writing, and Nepali tech media",
  "description": "Programiz is the largest globally — founded in Kathmandu, 15M+ pageviews/month. Amit Chaudhary's blog is widely cited for ML/NLP. Podcasts span engineering culture (Do No Merge), startups (Local Startup), and society (Boju Bajai).",
  "icon": "✦",
  "order": 18,
  "resources": [
    {
      "name": "Amitness Blog",
      "url": "https://amitness.com",
      "description": "Amit Chaudhary's blog — visual ML and NLP explainers, widely cited.",
      "status": "community",
      "maintenance": "active",
      "api": "none",
      "starred": true
    },
    {
      "name": "Programiz",
      "url": "https://www.programiz.com",
      "description": "Founded 2011 in Kathmandu. Globally 15M+ pageviews/month for programming tutorials.",
      "status": "official",
      "maintenance": "active",
      "api": "none",
      "starred": true
    },
    {
      "name": "Leapfrog Tech Blog",
      "url": "https://www.lftechnology.com/blog",
      "description": "Engineering blog from Leapfrog Technology.",
      "status": "official",
      "maintenance": "active",
      "api": "none"
    },
    {
      "name": "TechLekh",
      "url": "https://techlekh.com",
      "description": "Nepali tech news in English and Nepali.",
      "status": "community",
      "maintenance": "active",
      "api": "none"
    },
    {
      "name": "TechSathi",
      "url": "https://www.techsathi.com",
      "description": "Tech reviews and news from Nepal.",
      "status": "community",
      "maintenance": "active",
      "api": "none"
    },
    {
      "name": "TechPana",
      "url": "https://techpana.com",
      "description": "Nepali tech news and reviews.",
      "status": "community",
      "maintenance": "active",
      "api": "none"
    },
    {
      "name": "GadgetByte Nepal",
      "url": "https://www.gadgetbytenepal.com",
      "description": "Long-running gadget review and tech news site.",
      "status": "community",
      "maintenance": "active",
      "api": "none"
    },
    {
      "name": "ICT Frame",
      "url": "https://ictframe.com",
      "description": "ICT-focused news outlet.",
      "status": "community",
      "maintenance": "active",
      "api": "none"
    },
    {
      "name": "CodingNepal (YouTube)",
      "url": "https://www.youtube.com/c/CodingNepal",
      "description": "Web-development tutorials YouTube channel.",
      "status": "community",
      "maintenance": "active",
      "api": "none"
    },
    {
      "name": "Do No Merge Podcast",
      "url": "https://podcasts.apple.com/podcast/do-no-merge/id1452566879",
      "description": "Leapfrog's engineering-culture podcast.",
      "status": "community",
      "maintenance": "unknown",
      "api": "none",
      "starred": true,
      "note": "[Automated] Link appears to be broken or unreachable."
    },
    {
      "name": "Local Startup Podcast",
      "url": "https://www.localstartup.com.np",
      "description": "Startup conversations hosted by Ugant Sharma.",
      "status": "community",
      "maintenance": "unknown",
      "api": "none",
      "note": "[Automated] Link appears to be broken or unreachable."
    },
    {
      "name": "Boju Bajai",
      "url": "https://bojubajai.com",
      "description": "Long-running Nepali podcast on society, politics, gender (since 2016).",
      "status": "community",
      "maintenance": "unknown",
      "api": "none",
      "note": "[Automated] Link appears to be broken or unreachable."
    },
    {
      "name": "TechPana Podcast",
      "url": "https://techpana.com/podcast",
      "description": "Tech-focused Nepali podcast.",
      "status": "community",
      "maintenance": "unknown",
      "api": "none",
      "note": "[Automated] Link appears to be broken or unreachable."
    },
    {
      "name": "Sushant Pradhan Podcast",
      "url": "https://www.youtube.com/@SushantPradhanPodcast",
      "description": "Long-form interview podcast.",
      "status": "community",
      "maintenance": "active",
      "api": "none"
    }
  ]
}
