{
  "id": "ecommerce-jobs",
  "title": "E-Commerce & Jobs",
  "tagline": "Online marketplaces, classifieds, and job boards",
  "description": "Daraz dominates Nepali e-commerce. HamroBazaar leads classifieds. merojob leads job boards. None publish public APIs; community scrapers exist for Daraz and Foodmandu.",
  "icon": "◧",
  "order": 16,
  "resources": [
    {
      "name": "Daraz Nepal",
      "url": "https://www.daraz.com.np",
      "description": "Largest Nepali e-commerce platform. No official public API.",
      "status": "official",
      "maintenance": "active",
      "api": "none",
      "starred": true
    },
    {
      "name": "sushil-rgb/Daraz-Global-WebScraper",
      "url": "https://github.com/sushil-rgb/Daraz-Global-WebScraper",
      "description": "Daraz product scraper.",
      "status": "unofficial",
      "maintenance": "active",
      "api": "scraper"
    },
    {
      "name": "HamroBazaar",
      "url": "https://hamrobazaar.com",
      "description": "Largest Nepali classifieds platform.",
      "status": "official",
      "maintenance": "active",
      "api": "none"
    },
    {
      "name": "Muncha",
      "url": "https://www.muncha.com",
      "description": "Nepal's earliest e-commerce site (since 2000).",
      "status": "official",
      "maintenance": "active",
      "api": "none"
    },
    {
      "name": "Gyapu",
      "url": "https://gyapu.com",
      "description": "Fast-growing post-COVID e-commerce platform.",
      "status": "official",
      "maintenance": "active",
      "api": "none"
    },
    {
      "name": "Thulo.com",
      "url": "https://thulo.com",
      "description": "Online marketplace since 2005 (formerly NepBay).",
      "status": "official",
      "maintenance": "active",
      "api": "none"
    },
    {
      "name": "merojob",
      "url": "https://merojob.com",
      "description": "#1 Nepali job board. ISO 9001:2015. 300M+ pageviews/yr, 600K+ seekers.",
      "status": "official",
      "maintenance": "active",
      "api": "none",
      "starred": true
    },
    {
      "name": "JobAxle",
      "url": "https://jobaxle.com",
      "description": "IT and engineering-focused job board.",
      "status": "official",
      "maintenance": "unknown",
      "api": "none",
      "note": "[Automated] Link appears to be broken or unreachable."
    },
    {
      "name": "Kumari Job",
      "url": "https://www.kumarijob.com",
      "description": "10K+ active jobs.",
      "status": "official",
      "maintenance": "active",
      "api": "none"
    },
    {
      "name": "Froxjob",
      "url": "https://www.froxjob.com",
      "description": "Job board with focus on professional roles.",
      "status": "official",
      "maintenance": "active",
      "api": "none"
    },
    {
      "name": "RamroJob",
      "url": "https://www.ramrojob.com",
      "description": "General job board.",
      "status": "official",
      "maintenance": "active",
      "api": "none"
    },
    {
      "name": "corrupted-brain/MeroJob-Webscraper",
      "url": "https://github.com/corrupted-brain/MeroJob-Webscraper",
      "description": "merojob scraper for analysis.",
      "status": "unofficial",
      "maintenance": "stale",
      "api": "scraper"
    }
  ]
}
